{
  "schema_version": "2.0",
  "action_id": "3f0c2a9e-5b1d-4c7a-9a52-0d6e1f8b7c11",
  "status": "pending",
  "reasons": ["jev_unavailable_pending_ttl"],
  "features": { "recipient_count": 2, "dry_run": false },
  "jev_answers": {},
  "source": "jev",
  "latency_ms": 500,
  "cost_usd": 0,
  "decided_at": "2026-10-17T15:00:01Z"
}
