{
  "schema_version": "2.0",
  "action_id": "a4b3c2d1-e0f9-4876-8123-456789abcdef",
  "status": "decided",
  "verdict": "allow",
  "reasons": ["within_policy"],
  "features": {"changed_files": 2, "touches_ci": false, "touches_secrets": false},
  "jev_answers": {},
  "source": "mock",
  "latency_ms": 1.2,
  "cost_usd": 0,
  "decided_at": "2026-10-17T15:00:01Z"
}
