{
  "schema_version": "2.0",
  "action_id": "a4b3c2d1-e0f9-4876-8123-456789abcded",
  "status": "decided",
  "verdict": "deny",
  "reasons": ["email_recipients_high"],
  "features": {"recipient_count": 300, "has_pii_regex": false, "dry_run": false},
  "jev_answers": {},
  "source": "mock",
  "latency_ms": 1.4,
  "cost_usd": 0,
  "decided_at": "2026-10-17T15:00:03Z"
}
