{
  "schema_version": "2.0",
  "action_id": "a4b3c2d1-e0f9-4876-8123-456789abcdee",
  "status": "decided",
  "verdict": "ask",
  "reasons": ["critical_files_require_review"],
  "features": {"changed_files": 1, "touches_ci": true, "touches_secrets": false},
  "jev_answers": {},
  "source": "mock",
  "latency_ms": 1.3,
  "cost_usd": 0,
  "decided_at": "2026-10-17T15:00:02Z"
}
